[{
  "stepId": "stepId",
  "description": "description",
  "rationale": "rationale",
  "timePeriod": {
    "startDateTime": "2016-10-15"
  },
  "processor": [{
      "role": "role",
      "roleExtent": [{
        "temporalExtent": [{
          "timePeriod": {
            "startDateTime": "2016-10-24T11:10:15.2-10:00"
          }
        }]
      }],
      "party": [{
        "contactId": "individualId0"
      }]
    },
    {
      "role": "role",
      "roleExtent": [{
        "temporalExtent": [{
          "timePeriod": {
            "startDateTime": "2016-10-24T11:10:15.2-10:00"
          }
        }]
      }],
      "party": [{
        "contactId": "individualId0"
      }]
    }
  ],
  "stepSource": [{
    "description": "description",
    "sourceCitation": {
      "title": "title"
    },
    "metadataCitation": [{
      "title": "title"
    }, {
      "title": "title"
    }],
    "spatialResolution": {
      "measure": {
        "type": "distance",
        "value": 99.9,
        "unitOfMeasure": "unitOfMeasure"
      }
    },
    "referenceSystem": {
      "referenceSystemType": "referenceSystemType",
      "referenceSystemIdentifier": {
        "identifier": "identifier"
      }
    },
    "sourceProcessStep": [{
      "description": "description"
    }, {
      "description": "description"
    }]
  }],
  "stepProduct": [{
    "description": "description",
    "sourceCitation": {
      "title": "title"
    },
    "metadataCitation": [{
      "title": "title"
    }, {
      "title": "title"
    }],
    "spatialResolution": {
      "measure": {
        "type": "distance",
        "value": 99.9,
        "unitOfMeasure": "unitOfMeasure"
      }
    },
    "referenceSystem": {
      "referenceSystemType": "referenceSystemType",
      "referenceSystemIdentifier": {
        "identifier": "identifier"
      }
    },
    "sourceProcessStep": [{
      "description": "description"
    }, {
      "description": "description"
    }]
  }],
  "reference": [{
      "title": "title"
    },
    {
      "title": "title"
    }
  ],
  "processingInformation": { },
  "report": [ ]
}]
